{
  "id": "example-post",
  "title": "Example Post",
  "author": "Matt Faherty",
  "kind": "post",
  "slug": "example-post",
  "description": "A short post published through the same manifest-driven system as longer works.",
  "status": "draft",
  "tags": ["post", "example", "web"],
  "source": "content/posts/example-post.md",
  "web_route": "/posts/example-post/",
  "output_formats": ["site", "markdown"],
  "downloadable": true,
  "order": 1,
  "date": "2026-04-23",
  "updated": "2026-04-23"
}
